{
  "schema_version": "1.0.0",
  "readiness_id": "phase1-5-p1b-qwen3-vl-2b-authorization-readiness-20260927",
  "status": "READY_FOR_OWNER_DECISION",
  "t5_delivery_head": "0b04abdc57a3fa332689cfe664f9bcb997160e5e",
  "reviewed_product_source": "a69ede68f3e54e5ab006dbfd7a65c33040590f93",
  "t3_base": "14a56f49e1220eb8139bf7280c747124118fdb21",
  "p1a_sources": [
    {"path": "docs/phase1_5/p1a/primary_artifact_authorization_draft.v1.json", "bytes": 2171, "sha256": "7fcab9f1c351f5473a8bde7b2e23185d2888610c27e1fb6d6c4a0e0ab718d5b5"},
    {"path": "docs/phase1_5/p1a/qwen_candidate_inventory.v1.json", "bytes": 4192, "sha256": "ba432763ee70321eaac4e0314588701f25a833471030d33fee9dd6ee404bc9a1"},
    {"path": "docs/phase1_5/p1a/qwen_weight_license_evidence.v1.json", "bytes": 2485, "sha256": "08ac3a64b9bf4e189c8955bd8106b37a8deb20d8d44f9be9d131c7392f95adac"},
    {"path": "docs/phase1_5/p1a/public_corpus_manifest.v3.json", "bytes": 126442, "sha256": "9da0ccdeaa367c1c15e314fb2c64a8e487ddf028c0ec532d30c097c3be62efa6"},
    {"path": "docs/reference/reference_bundle.v1.schema.json", "bytes": 3292, "sha256": "387e1f4749db3dbe34a5aab0e9618a05f1c4349eb02c567ebfc180a435301700"},
    {"path": "docs/reference/provider_analysis_envelope.v1.schema.json", "bytes": 8488, "sha256": "014f69f0eda46b806b7632e6440d85be9a5ccb78461a2a78418fb5c4ac78f194"},
    {"path": "docs/phase1_5/error_policy.v1.json", "bytes": 5599, "sha256": "821466ba68385f3c9628d96dbfc5b27e1d5628ef554b879e086aacc6b42ea7f9"}
  ],
  "primary_artifact": {
    "model_id": "Qwen/Qwen3-VL-2B-Instruct",
    "immutable_revision": "89644892e4d85e24eaac8bacfd4f463576704203",
    "weight_filename": "model.safetensors",
    "weight_bytes": 4255140312,
    "weight_lfs_sha256": "7de1838c87a5349b016c26a1c3f7d2bc400a3d485f95ef39a7059ffd734977a0",
    "repository_file_count": 12,
    "repository_total_bytes": 4266648961,
    "source_domains": ["huggingface.co", "us.aws.cdn.hf.co"]
  },
  "corpus": {
    "manifest": "docs/phase1_5/p1a/public_corpus_manifest.v3.json",
    "approved_count": 21,
    "quarantine_count": 8,
    "owner_media": "prohibited",
    "status": "CORPUS_R3_VALIDATED"
  },
  "contract_identities": {
    "reference_bundle": "docs/reference/reference_bundle.v1.schema.json",
    "provider_envelope": "docs/reference/provider_analysis_envelope.v1.schema.json",
    "error_policy": "docs/phase1_5/error_policy.v1.json"
  },
  "authorization": {
    "download_authorized": false,
    "runtime_authorized": false,
    "inference_authorized": false,
    "app_integration_authorized": false,
    "pipeline_integration_authorized": false,
    "private_media_authorized": false,
    "execution_authorized": false,
    "legal_review_status": "NOT_LEGAL_APPROVED",
    "transport_status": "REDIRECT_DOMAIN_NOT_INDEPENDENTLY_VERIFIED",
    "owner_decision": "NONE_TRACKED"
  },
  "stop_conditions": [
    "Any identity, filename, byte count, SHA, license, corpus count or contract identity differs.",
    "Any network, download, model framework, runtime, image or private-media access is required.",
    "Owner authorization is absent or attempts to authorize more than artifact quarantine.",
    "A validator, contract, privacy or scope check fails."
  ]
}
